微博id,微博正文,头条文章url,原始图片url,微博视频url,发布位置,发布时间,发布工具,点赞数,转发数,评论数
OExHC2ZUJ,秋天到了，苹果🍏开始慢慢下树啦！大家都知道脊梁对水果还是挺挑剔的但是这款绿苹果【🍏陕西高原瑞雪苹果】去年吃过后就一直念念不忘😍高甜度❗️高脆度❗️高颜值❗️吃进嘴里，松脆可口，风味浓郁👍可算等到2024年的瑞雪上市啦！瑞雪🍏是我国自主研发的拥有自主知识产权的苹果新品种💪真正的黄土高原上的国货之光✨ 拿起ta🍏就能闻到一股花果香味脆甜，爽口，香浓多汁💦口感丰富好吃到原地爆炸💥基本属于是谁吃谁都要回购的那种！脊梁今年选择开团的🍏瑞雪苹果都来自陕西咸阳永寿县海拔1200米的高原⛰️哪怕同样是产自陕西的苹果🍎高山苹果也要比平原苹果好吃一大截！更有个特点是耐储藏，久放不面不蔫根本不用怕吃不完💯大家抓紧下手现在有限时秒杀瑞雪🍏特惠活动仅需5⃣9⃣元，到手4-4.5斤 [组图共9张] 原图 ,,"https://ww2.sinaimg.cn/large/56df5c93gy1hvrnpp6ntlj20hi0s4n26.jpg,https://ww2.sinaimg.cn/large/56df5c93gy1hv90lo8u6ug20qo0k0npe.gif,https://ww4.sinaimg.cn/large/56df5c93gy1hv90lpszenj20u0140kcy.jpg,https://ww4.sinaimg.cn/large/56df5c93gy1hv90lz1ra8j20xc2xz1kx.jpg,https://ww2.sinaimg.cn/large/56df5c93gy1hv90lr2pj8j20m80m80w5.jpg,https://ww4.sinaimg.cn/large/56df5c93gy1hvrnqi542cj20o80l6ajw.jpg,https://ww3.sinaimg.cn/large/56df5c93gy1hv90lt3ettg20go09dnpi.gif,https://ww3.sinaimg.cn/large/56df5c93gy1hvrnpo97i3g20go09dqvb.gif,https://ww1.sinaimg.cn/large/56df5c93gy1hvrnqavfgaj210o1emgrq.jpg",无,无,2024-11-03 14:06,荣耀X50,15,2,17
OEveOjWU9,上海今天清晨出现大雾比较严重的是北部地区，能见度小于200米今天上海仍然是晴到多云天气气温和昨天一样，白天22～23℃，体感舒适强冷空气已经开始影响我国北方地区明天开始影响上海，将出现6～8度降温下周中期上海最高气温回落到16～17℃大家要做好防范，以免突然感冒#脊梁聊天气#  [组图共3张] 原图 ,,"https://ww1.sinaimg.cn/large/56df5c93gy1hv8pq4yfupj20xc21o7h0.jpg,https://ww4.sinaimg.cn/large/56df5c93gy1hv8pq5uxlrj20xc21o48q.jpg,https://ww2.sinaimg.cn/large/56df5c93gy1hv8pq8ge5oj20xc0oyn26.jpg",无,无,2024-11-03 07:49,荣耀X50,22,2,5
OEqLNqPOU,今天日本的雨也挺大的台风康妮的残余今天横扫了日本我在酒店一天没怎么出门#台风康妮# 脊梁in上海SH的微博视频  ,,无,无,无,2024-11-02 20:27,微博视频号,26,0,10
OEqB79zi3,脊梁前两天收到了5枝多头芳华百合🌸是上海种业稀有测试新品92号🌟脊梁感觉是我养过最炫目的百合之一‼️它的杆子很粗壮、分叉很优秀、花蕾也多最主要花瓣有足足五重瓣，而且层次清晰所以脊梁分成了两支、三支一束摆在公司门口，一束摆在我办公室美不胜收、芳香四溢它的花瓣层层叠叠，像绸缎一样有质感层次很好，能开出3种颜色😍粉色渐变、绿色清新、白色纯洁交替呈现，放在办公室看着就赏心悦目😀还散发着淡雅甜美的百合香😘多头芳华百合因为是超稀有的测试品所以一年上市🎉只卖5天🖐🏻脊梁开团的绿植类产品🌳一定都是经过超级严格筛选的这家是现采现发，顺丰冷链包邮打包规格很高，不会有碰伤～可以参考视频2💐3支保底12个头💐5支保底20个头喜欢百合的朋友可以闭眼冲现在随单还送可利鲜百合粉🌸[查看全部图片/视频] ,,无,无,无,2024-11-02 20:00,荣耀X50,13,1,2
OEmZu7708,黄圣依是住在热搜上了吗？烦死了，一天天的是要告诉她什么事情还要上热搜说#谁可以告诉黄圣依这件事情#  原图 ,,https://wx1.sinaimg.cn/large/56df5c93gy1hv7paugaoqj20xc21oao2.jpg,无,无,2024-11-02 10:50,荣耀X50,82,0,14
OElUhpbAc,台风康妮对上海的影响昨晚8点前后结束上海普降大暴雨，局地特大暴雨台风残余今天席卷日本上海今天转为好天气，多云为主气温略有回升，白天最高22℃大家需要留心下周初南下的强冷空气上海会出现6～7度的降温，下周中期气温偏低周中最高气温会回落到16～17℃#脊梁聊天气#  [组图共3张] 原图 ,,"https://ww1.sinaimg.cn/large/56df5c93gy1hv7kj8o1mij20xc0osdk4.jpg,https://ww4.sinaimg.cn/large/56df5c93gy1hv7kj962euj20ta1mp78s.jpg,https://ww3.sinaimg.cn/large/56df5c93gy1hv7kj9rjvoj20tf1mpah7.jpg",无,无,2024-11-02 08:04,荣耀X50,24,3,7
OEhj1fHJN,台风康妮对上海的主要影响过程结束🔚接下来就是一点毛毛雨，和一点风明天早上天气就会慢慢转好🌞🌞🌞截止今晚20点上海24h累积雨量普遍在大暴雨级别东南部的浦东南部、奉贤等地出现特大暴雨徐家汇24h雨量172毫米国家站中浦东188毫米最高，奉贤180毫米自动站中浦东老港和祝桥突破250毫米达到了特大暴雨级别#台风康妮# [组图共5张] 原图 ,,"https://ww3.sinaimg.cn/large/56df5c93gy1hv7058sgjwj20li10u4qp.jpg,https://ww3.sinaimg.cn/large/56df5c93gy1hv7059pqmaj20xc21o49o.jpg,https://ww1.sinaimg.cn/large/56df5c93gy1hv705bb44bj20xc21onee.jpg,https://ww1.sinaimg.cn/large/56df5c93gy1hv705c82c8j20xc21otle.jpg,https://ww3.sinaimg.cn/large/56df5c93gy1hv705d12bej20xc21otly.jpg",无,无,2024-11-01 20:21,荣耀X50,15,1,4
OEgPKn7HF,台风康妮对上海的主要影响过程即将结束西郊的雨已经基本停了下来市区的雨很快也会显著减弱东南部最晚结束，今天深夜结束上海累积雨量大暴雨，太罕见了#台风康妮# 脊梁in上海SH的微博视频  ,,无,无,无,2024-11-01 19:09,微博视频号,21,4,7
OEgmlDxdm,老公主连佛手也不认得还肉手不过她收到的这个佛手品相还真好这面看刚好五根手指  [组图共2张] 原图 ,,"https://ww3.sinaimg.cn/large/56df5c93gy1hv6w131ur6j20xc21ogt4.jpg,https://ww2.sinaimg.cn/large/56df5c93gy1hv6w13xll5j20u01hcdng.jpg",无,无,2024-11-01 17:57,荣耀X50,31,1,18
OEfGZttK8,15:30分前后上海的雨势有所减弱本轮降雨的最高潮过去了晚高峰看样子有希望穿雨洞🕳️#台风康妮#  原图 ,,https://wx2.sinaimg.cn/large/56df5c93gy1hv6t3m4yruj20li10ub29.jpg,无,无,2024-11-01 16:15,微博网页版,20,4,10
OEdYOdxIf,脊梁这的三文鱼开团才半年已经积累了一批忠实粉丝了🤩跟团十多次的顾客大有人在转眼已经11月了🥲进入三文鱼旺季接下来受海外节假日🗓影响咱们的三文鱼的价格将有所上涨📈趁着未涨价前的双十一狂欢大家抓紧时间大快朵颐吧🍽️🧧三文鱼双十一限时狂欢活动⏰👉买任意一份产品，即🉑9.9元换购刺身级鲜食贝柱🐚（200g）‼️多买多换肉质紧实，QQ弹弹💦可炒菜吃也可直接当刺身生吃🍣饭桌上一盘三文鱼一盘贝柱🌊鲜味拉满😍本团还有惊喜🍣顶级蓝鳍金枪鱼上新🆕全是🇪🇸西班牙进口的“深海极品”肉质柔嫩鲜美，营养价值还高有大腹&赤身两种规格，强烈推荐大腹作为金枪鱼身上最肥美、最昂贵的部位漂亮的油脂雪花❄直接诠释什么叫【入口即化】👍脊梁这的三文鱼团最大的特点就是品质稳定✅几乎0客诉，回头客超级多👍所有三文鱼都现切现发🚚绝对新鲜💯刺身脑袋可以按需选择⬇▶入口即化、极致口感选新西兰🇳🇿帝王鲑▶性价比高、口感较韧选挪威🇳🇴▶接近帝王鲑口感，接近挪威价格选冰岛🇮🇸大家趁着低价的尾巴，赶紧入手吧🎉 [组图共9张] 原图 ,,"https://ww4.sinaimg.cn/large/56df5c93gy1hv6lj4zhrmj20hi0w4k3y.jpg,https://ww1.sinaimg.cn/large/56df5c93gy1hv6lj243nfg20a70fb7wn.gif,https://ww1.sinaimg.cn/large/56df5c93gy1hv6lj6g82aj20zk1hc7h4.jpg,https://ww1.sinaimg.cn/large/56df5c93gy1hv6lj8p1u1j20sg1ks4e9.jpg,https://ww3.sinaimg.cn/large/56df5c93gy1hv6lj99f1gj20da0m8q55.jpg,https://ww4.sinaimg.cn/large/56df5c93gy1hv6lj9suj3j20da0m8q5e.jpg,https://ww4.sinaimg.cn/large/56df5c93gy1hv6ljb6t6ij20sg1drn8k.jpg,https://ww1.sinaimg.cn/large/56df5c93gy1hv6ljecoawj20sg23vh52.jpg,https://ww2.sinaimg.cn/large/56df5c93gy1hv6ljfnchgj20sg1kwn9f.jpg",无,无,2024-11-01 11:53,iPhone 13 Pro,44,9,22
OEcY0zSvQ,目前台风康妮的中心在台湾海峡北缘宁德和温州之间的海上，靠近浙闽交界因为北面有冷空气，冷暖交汇所以台风北面风雨较大，降雨也更丰沛上海今天全天维持台风雨天气因为台风雨具有螺旋性和间歇性，会有雨洞所以阵雨忽大忽小是正常现象偶尔停下来也很正常，一会儿继续下不要雨停下来就哇啦哇啦叫搞得来像没见过台风的巴子一样今天晚上康妮的中心距离上海最近西北部的雨会最早停下东南部的雨可能要持续到明天凌晨这个双休日上海天气好的，可以浪#台风康妮# http://t.cn/A6nJPxyv ,,无,无,无,2024-11-01 09:18,微博视频号,105,6,17
OEcn277ME,这雨也太猛了脊梁前两天就告诉同事们本周五居家办公了大家今天去上班吗#台风康妮# 大家今天上班吗  ,,无,无,无,2024-11-01 07:47,iPhone 13 Pro,1090,5,60
OEckyuUZ7,上海今天的天气也没什么好说的了就是雨雨雨雨雨雨雨雨雨雨雨雨雨雨雨雨雨雨雨雨雨雨雨雨雨雨雨雨雨雨雨雨雨雨雨雨雨雨雨雨雨雨雷达图上看，今晚前这雨是不会停下来的截止今天早晨7点徐家汇24h累积雨量112毫米，大暴雨普陀甘泉路暂列冠军🏆171毫米，大暴雨这雨这样下下去，局地特大暴雨（250mm）气温方面雨水让气温恒定今天的气温就锁死在19度上下#台风康妮##脊梁聊天气# http://t.cn/A6nxgGl2 ,,无,无,无,2024-11-01 07:41,微博视频号,85,5,18
OE8RjpP86,强降雨区22点前后覆盖上海市区23点覆盖全上海，康妮倒槽降雨高潮开始了#台风康妮# 脊梁in上海SH的微博视频  ,,无,无,无,2024-10-31 22:51,微博视频号,26,4,18
OE7Mgao21,晚高峰上海幸运地穿越雨洞雷达图显示，目前台州、宁波外海的雨区很强这片雨区预计3小时后逼近上海强降雨区预计23点前后抵达上海上海的强降雨会从今天深夜持续到夜间#台风康妮# 脊梁in上海SH的微博视频  ,,无,无,无,2024-10-31 20:06,微博视频号,91,6,20
OE7BS2hUx,落地日本看到的第一个通知  原图 ,,https://wx3.sinaimg.cn/large/56df5c93gy1hv5tf09d3kj20wi16q16h.jpg,无,无,2024-10-31 19:40,iPhone 13 Pro,55,3,23
OE5zFetbJ,新一波台风倒槽降雨预计16点抵达上海大家下班的时候记得要带好雨具☔️台风康妮倒槽和外围云系对上海影响的高潮会从今天晚上开始，持续到周五深夜上海东南部持续时间更长一些，到周六早晨雨的影响远大于风，大家注意防范#台风康妮# 脊梁in上海SH的微博视频  ,,无,无,无,2024-10-31 14:29,微博视频号,37,1,11
OE5y2CuCq,台风康妮登陆时的雷达回波图14点登陆台湾台东县时，康妮为强台风级别接下来中央山脉和冷空气会联手撕碎康妮#台风康妮##脊梁聊天气# 脊梁in上海SH的微博视频  ,,无,无,无,2024-10-31 14:25,微博视频号,16,1,4
OE5rjDTKE,天冷了就想吃羊肉🍖了上周脊梁开团的藏书羊糕好评如潮👍因为在别的地方买的冻多肉少很抠搜🌚脊梁这家含肉量很高✅能吃出来肉很新鲜鲜嫩入味，没有一点腥味😋特别下饭羊肉属于温热食物，秋冬吃点羊肉😍可以由内而外地抗寒🔥🔥🔥这周我们上新了藏书羊肉·白切羊肉‼️藏书羊肉本身在江南就是如雷贯耳、久负盛名我们的白切羊肉很正宗，原汁原味😍全部都是🌟纯纯羊腿肉🐑🍗很紧实自己买羊肉很怕烧不好有膻味🍖强推买白切羊肉回去👍直接蘸酱吃或者下面条、煮羊肉锅，都很舒服的～藏书羊糕也很推荐，开袋即食非常鲜美～就是是由羊肉和羊汤冻混合冻成的糕状牙齿不好也能吃，很适合老人小孩🧒脊梁这团的羊糕/羊肉，绝对不是冷冻品🙅每天采用新鲜羊肉🐑新鲜现制发货✅现在购白切羊肉，还送羊肉原汤+羊油🧧秋冬吃口羊肉，再来碗羊汤，暖心又暖胃啊💖⚠️羊糕开袋切片即食✅切勿加热，是一道冷菜‼️白切羊肉和羊汤都是无咸味的，非常淡口‼️可自行加调料[查看全部图片/视频] ,,无,无,无,2024-10-31 14:09,iPhone 13 Pro,37,1,18
OE4EEr9Qr,今年21号台风康妮的本体今天下午即将在台湾台东登陆目前强度仍然维持超强台风级别台风康妮的倒槽今天早晨已经给上海带来一阵短时大雨上海主要的降雨今天傍晚前后开始今晚到明天全天上海暴雨，局地大暴雨但是因为我们是受台风倒槽的影响和台风本体并不发生关系所以今明两天风的影响较小#脊梁聊天气##台风康妮# http://t.cn/A6nMMhsc ,,无,无,无,2024-10-31 12:09,微博视频号,58,3,20
OE3x7u126,第一波台风倒槽雨9点不到抵达上海市区还好带伞了#脊梁聊天气# 脊梁in上海SH的微博视频  ,,无,无,无,2024-10-31 09:17,微博视频号,27,3,19
OE33vBxo8,台风康妮的本体还在台湾以东洋面今天中午前后会在台湾登陆但台风的倒槽已经来到上海附近上海南部今晨已经受到影响受到台风康妮倒槽的影响上海今天阴有时有雨，市区中午前转雨今天白天的雨量还不算大云系比较厚，上海今天白天最高气温23度本轮降雨高潮会从今晚开始，持续到周五深夜东南部降雨会一直持续到周六上午前后累计雨量暴雨到大暴雨，大家做好防范台风康妮的外围云系对上海的影响周六结束本周日会是个好天气#脊梁聊天气##台风康妮# http://t.cn/A6nIe5vf ,,无,无,无,2024-10-31 08:05,微博视频号,106,5,24
ODYF1ohZu,台风康妮仍然维持超强台风强度将会于明天下午在台湾登陆对上海的影响也会从明天傍晚前后开始主要影响时段是明天夜间到周五深夜上海有暴雨，东南部大暴雨雨的影响大于风，大家做好准备真的没想到，11月还要战台风好癫#脊梁聊天气##台风康妮# 脊梁in上海SH的微博视频  ,,无,无,无,2024-10-30 20:53,微博视频号,101,14,25
ODVPhzK1o,台风康妮对上海的影响比较明朗了主要的影响从明天傍晚开始，持续到后天深夜10月31日晚到11月1日，上海会出现暴雨东南部雨量更大一些，大暴雨程度过程雨量120～180毫米东南部可达220～280毫米最大小时雨强40～70毫米这次的降水具有极端性可能成为1981年以来上海11月最大降水过程这次的影响过程雨大于风好消息是双休日台风的影响结束，可以浪#台风康妮##脊梁聊天气# http://t.cn/A6nf5zPJ ,,无,无,无,2024-10-30 13:40,微博视频号,257,22,42
ODVveBBUF,终于等到2024年香榧子新货❗正宗诸暨枫桥特级香榧子上市啦，全部现炒现发上海人对香榧子的珍爱人尽皆知❤️吃起来松‼️脆‼️香‼️回味无穷♾️很适合看球追剧时搞一袋😋虽然香榧子脊梁从小吃到大但有同事完全没见过、甚至没听过吃的时候用牙咬，费劲地用指甲刮黑皮其实吃香榧子很简单毫不费力👍找准“西施眼”轻轻一捏就开口了（见视频）那层黑皮可以用外壳轻轻刮掉✅剥好的果仁吃起来真的巨香🤤作为坚果界的爱马仕👑香榧子市场一直鱼龙混杂有很多用陈年货、嫁接树❌以次充好的网上刷到很多人觉得香榧子不好吃说一股中药味❌木头味❌像在吃土🤮相信我，你一定是没有买到真正新鲜、优质的香榧子‼️脊梁找的这家香榧子全部采自诸暨枫桥农家的古树香榧🌲农家阿姨人工采摘，轻盐炒制是100%的新货🔥每一批都是现炒现发‼️人工一颗颗分拣，炒前挑一次，炒后挑一次品质这块大家绝对放心❤[查看全部图片/视频] ,,无,无,无,2024-10-30 12:51,iPhone 13 Pro,40,3,24
ODPT4yVye,目前看上海受21号台风康妮影响主要的降雨从周四傍晚开始周五的降雨比较猛烈，双休日倒是还好明天再看看#脊梁聊天气#  原图 ,,https://wx2.sinaimg.cn/large/56df5c93gy1hv3n69re3tj21cg0u8tug.jpg,无,无,2024-10-29 22:33,iPhone 13 Pro,35,2,16
ODNVzaSMR,恒银科技今天最后一分钟可真猛1分钟搞定天地板 脊梁in上海SH的微博视频  ,,无,无,无,2024-10-29 17:34,微博视频号,15,2,4
ODNyvryqg,台风康妮今天白天整合得不错目前已经有台风强度明后天会加强为超强台风预计本周末康妮的残留云系会对上海有影响本周五和周六上海可能出现暴雨⛈️#台风康妮# 脊梁in上海SH的微博视频  ,,无,无,无,2024-10-29 16:37,微博视频号,18,5,23
ODN8ZpVvQ,今天下午15点前后上海西面天空出现了环天顶弧🌈  [组图共2张] 原图 ,,"https://ww4.sinaimg.cn/large/56df5c93gy1hv3b2cyb3pj23402c0qtv.jpg,https://ww4.sinaimg.cn/large/56df5c93gy1hv3b2djutoj21bf0zk418.jpg",无,无,2024-10-29 15:34,iPhone 13 Pro,58,14,26
ODN1LnxXN,《再见爱人》这档综艺脊梁本来是冲着黄圣依杨子去看的看到一半发现，#李行亮麦琳 无限流式吵架# 貌似才是问题最大的啊婚姻状况，绝对是很顶配的了但他对李行亮各种挑剔不满意用自己付出去控制pua另一半明明李的钱都上交了，还说没给她买礼物节目里，李行亮描述麦琳“抠”的吓人今天看到网友扒出来她的闲鱼发现还真是比普通人还要节俭出香奈儿包和闲置家居还正常对吧但看下去，还有成色破烂的儿童鞋用过的奶瓶，买假睫毛送的胶水氧化到全部发黑的的apm耳环配文“维修一下送人挺合适的”甚至还有已经吃掉一层的麦片还有麦琳的朋友发文说她能关注到自己的各种小情绪但就这么个贴心的人怎么会在节目里说出“离开李行亮我的生活会有火箭般的提升”对着自己的爱人，这种细腻都去哪了？？人真是不能既要又要还要 [组图共9张] 原图 ,,"https://ww1.sinaimg.cn/large/56df5c93gy1hv3ajs7uhrj20lh1443zy.jpg,https://ww3.sinaimg.cn/large/56df5c93gy1hv3ajsguuej20m10pgace.jpg,https://ww2.sinaimg.cn/large/56df5c93gy1hv3ajsuibgj20v9126gu1.jpg,https://ww2.sinaimg.cn/large/56df5c93gy1hv3ajt5dp4j20go0njtd2.jpg,https://ww2.sinaimg.cn/large/56df5c93gy1hv3ajrkk8pj20go0oujtq.jpg,https://ww1.sinaimg.cn/large/56df5c93gy1hv3ajtfytwj20go0s0adf.jpg,https://ww4.sinaimg.cn/large/56df5c93gy1hv3ajtss94j20r819n42e.jpg,https://ww2.sinaimg.cn/large/56df5c93gy1hv3aju9h3lj20u01oyti1.jpg,https://ww4.sinaimg.cn/large/56df5c93gy1hv3ajuljjuj20t215215c.jpg",无,无,2024-10-29 15:16,iPhone 13 Pro,15,1,7
ODMOdmWTS,日本的那些奇葩店名第二家赢了  [组图共9张] 原图 ,,"https://ww4.sinaimg.cn/large/56df5c93gy1hv39kmfvo9j20sf164n3l.jpg,https://ww3.sinaimg.cn/large/56df5c93gy1hv39klr0h4j20wi164tp4.jpg,https://ww4.sinaimg.cn/large/56df5c93gy1hv39kqp2j6j20wi0odgy8.jpg,https://ww1.sinaimg.cn/large/56df5c93gy1hv39kn4617j20wi16oqfw.jpg,https://ww3.sinaimg.cn/large/56df5c93gy1hv39kvziuvj20wi16r7f6.jpg,https://ww2.sinaimg.cn/large/56df5c93gy1hv39kx6tvkj20wi0oc47c.jpg,https://ww4.sinaimg.cn/large/56df5c93gy1hv39kxkuzjj20wi0l711p.jpg,https://ww3.sinaimg.cn/large/56df5c93gy1hv39ky5jy0j20wi16xk1y.jpg,https://ww1.sinaimg.cn/large/56df5c93gy1hv39kyj6omj20wi16r130.jpg",无,无,2024-10-29 14:43,iPhone 13 Pro,29,8,10
ODK9Gl2Q8,没想到已经快11月份还要关心台风21号台风康妮正在迅速增强预计明天会加强到超强台风级别台风在这时节靠近中国大陆无疑是自寻死路来到长三角附近时虽然已是台风残骸但残留云系仍会和冷空气共同作用很可能会在11月1～2日给上海带来暴雨上海今天晴到多云在冷高压控制下，气温依旧低迷今天凌晨市区14度，郊区10～12度今天白天最高20度上下，和前两天差不多晴好天气还能持续一天多，31日开始变天#台风康妮##脊梁聊天气#[查看全部图片/视频] ,,无,无,无,2024-10-29 07:58,iPhone 13 Pro,34,3,21
ODFqXtcY4,前几天刚说10月以后的秋台很难登陆我国大概被台风康妮听到了康妮偏要试试康妮会在副高的引导下向台湾靠近预计会在10月31日登陆台湾登陆后可能在福建二次登陆也有可能被西风槽勾走康妮接近华东后会被冷空气杀死，命不会长对上海的影响主要是11月1～2日本周末上海很可能会有连续两天大到暴雨具体的影响到周三前后会逐渐明朗#台风康妮# http://t.cn/A6n5gWrD ,,无,无,无,2024-10-28 19:56,微博视频号,39,0,31
ODCmVBB6y,大环境的确不太好连黑豹子和雪姨都下海了陆振华：依萍，夜场是真赚钱呀！你怎么不早告诉爹！傅文佩：振华，你这上的是什么班？你这工作怎么越做越晚？ 脊梁in上海SH的微博视频  ,,无,无,无,2024-10-28 12:08,微博视频号,48,6,6
ODAB2E8Ug,今天凌晨上海仍有毛毛雨但是已经是尾声，今天白天雨区就会散去今天上海阴转多云天气，下午天气逐渐转好今天全天气温比较低迷，最高20度上下深秋时节大家记得早晚要添衣本周天气最大的变数是21号台风康妮预计11月1～2日会给上海带来暴雨⛈️#台风康妮##脊梁聊天气# 脊梁in上海SH的微博视频  ,,无,无,无,2024-10-28 07:37,微博视频号,44,4,19
ODtZ1lECl,随着《再见爱人4》这周最新几集的播出大家才发现能上节目的几对夫妻个个都是顶级中的顶级，山外有山爹外有爹一对父女，一对母子，一对双胞胎除了非常离谱的杨子和刘爽李行亮&麦琳这对相对正常的夫妻反而最能引起共鸣#再见爱人4最应该离婚的一对#李行亮是06快男出道的歌手麦琳从李行亮还是个小透明时就与他在一起两人感情稳定很早就结了婚结婚后麦琳就一直在家做家庭主妇李行亮毋庸置疑是很爱很爱麦琳的但久而久之，没有工作、没有安全感、自我价值感的麦琳，就变得焦虑&神经质&极度别扭在生活中不停地pua李行亮，让他产生愧疚感来使自己成为这段关系的掌控者比如说买礼物李行亮买了就是李行亮浪费自己退掉礼物是为这个家做贡献但李行亮不买她又觉得心理失衡觉得李行亮在生活中不关心她然后就进了一个只有李行亮受伤的死循环节目中黄执中的一段话说得很好：这是一个出题人不想让你拿分的考试一次两次李行亮能包容但时间久了他自己的状态也会被麦琳群影响于是就有了他们在衣柜前的争吵这种关系就很像很多中国家庭的愧疚式教育桌上明明摆着一盘肉，明明够全家人吃然后父母故意不吃，把肉全给孩子吃然后一边看孩子吃一边说：我们都是为了你才不吃的，所以你要怎么怎么样才对得起我们的付出唯一值得庆幸的是，相比杨子和刘爽麦琳还有救，她至少是真心爱李行亮的希望她能早日找到自己的价值放过自己也放过李行亮吧 [组图共15张] 原图 ,,"https://ww3.sinaimg.cn/large/56df5c93gy1hv0yg6kl5zj20u00duq8m.jpg,https://ww2.sinaimg.cn/large/56df5c93gy1hv0yg8456kj20nm1b0qda.jpg,https://ww1.sinaimg.cn/large/56df5c93gy1hv0ygcipscj20j31ben66.jpg,https://ww4.sinaimg.cn/large/56df5c93gy1hv0ygobbalj20zk1bfale.jpg,https://ww3.sinaimg.cn/large/56df5c93gy1hv0yg5qgfuj20fa0yk43f.jpg,https://ww1.sinaimg.cn/large/56df5c93gy1hv0ygp7frdj20ga0tptcp.jpg,https://ww2.sinaimg.cn/large/56df5c93gy1hv0ygre24lj20z41q4gyb.jpg,https://ww4.sinaimg.cn/large/56df5c93gy1hv0ygrw795j20gh0lzznc.jpg,https://ww1.sinaimg.cn/large/56df5c93gy1hv0ygsek4aj20gl0m4ado.jpg,https://ww4.sinaimg.cn/large/56df5c93gy1hv0ygsyedxj20o50w77ac.jpg,https://ww3.sinaimg.cn/large/56df5c93gy1hv0ygtjn9vj20qo0i6gob.jpg,https://ww4.sinaimg.cn/large/56df5c93gy1hv0ygu5gszj20hl0nggov.jpg,https://ww4.sinaimg.cn/large/56df5c93gy1hv0ygv29a8j20gg13bdob.jpg,https://ww4.sinaimg.cn/large/56df5c93gy1hv0ygw5hvij20fk11jah9.jpg,https://ww3.sinaimg.cn/large/56df5c93gy1hv0yh16r3lj20zk1bfthi.jpg",无,无,2024-10-27 14:47,iPhone 13 Pro,20,3,6
ODtxw3BgM,郑钦文7:6/6:3力克🇺🇸肯宁拿到了WTA500东京站冠军🏆这也是郑钦文今年第3个冠军头衔赛点边裁判定IN郑钦文提出挑战并且很霸气地走到往前准备握手这份自信真的讨人喜欢#郑钦文东京夺冠# 脊梁in上海SH的微博视频  ,,无,无,无,2024-10-27 13:40,微博视频号,50,2,2
ODrxEvVCh,今年第21号台风康妮目前正在活跃它可能会在11月1日前后靠近华东沿海届时强度很可能达到超强台风级别不过靠近华东沿海也意味着康妮的死亡这个季节冷空气相当强劲康妮会在东海上被冷空气扒光衣服活活打死最后变成低压系统转向去日本🇯🇵#台风康妮# 脊梁in上海SH的微博视频  ,,无,无,无,2024-10-27 08:34,微博视频号,48,3,10
ODrk1l8UK,昨天上海下了一整天的雨虽然雨不大，但是下的时间足够长累计雨量普遍达到了中到大雨程度今天早晨上海依旧在下小雨🌧️上海今天还是雨天，这场雨下午会有所减弱完全停下来可能要到晚上了受到雨水打压今天气温情况和昨天接近白天气温在22度上下，体感并不冷明天起上海会出现连续的晴天☀️气温在22度上下，秋高气爽#脊梁聊天气#[查看全部图片/视频] ,,无,无,无,2024-10-27 08:01,iPhone 13 Pro,29,3,20
